{"schemaVersion":"1.0.0","kind":"publication-receipt","identity":"sha256:44a18a68f33d10212e731875cf889f0dcebd4042dc0557ccd464a316fb08542e","baseCommit":"6304c90f83df3cdb918dff03f6358dcf4a939d16","headCommit":"43113d9000000000000000000000000000000000","treeId":"2222222222222222222222222222222222222222","action":"PR_PUBLISHED","remoteRef":"refs/pull/3/head","resultId":"https://example.invalid/pr/3","createdAt":"2026-10-07T05:00:00Z"}
